{
  "schema_version": "1.0",
  "generated_at": "2026-09-19T11:56:24+00:00",
  "scope": {
    "measured_window": "2026-09-15 to 2026-09-19",
    "method": "count ladder with tiny images first, then single-image climb, then squeeze-to-exact; JSON body bytes",
    "conventions": [
      "Sizes are JSON request-body bytes, reported in binary units (MiB = 1024^2).",
      "A bracket is written 'largest accepted - first failure'; it is not a precise cap unless the squeeze run resolved one.",
      "A row with no byte wall found is a LOWER BOUND on that host, never 'unlimited'.",
      "'largest accepted' means HTTP 200 with max_tokens=1, one model per host, one region, one key tier.",
      "Structural caps (item counts, token budgets) bind before bytes on several hosts; the byte wall is then unreachable rather than absent."
    ]
  },
  "conventions": {
    "size_unit": "JSON request-body bytes, reported in binary MiB (1 MiB = 1,048,576 B)",
    "measured_field": "measured.largest_accepted.body_bytes is HTTP 200 evidence; measured.walls.<wall>.body_bytes is the first rejection of that kind",
    "bracket": "largest accepted - first failure; only exact where the squeeze run resolved it",
    "no_cap_means": "the ladder reached a structural cap (item count, token budget) before any byte wall, so the byte ceiling is a LOWER BOUND, never 'unlimited'",
    "cap_stated_in_error": "the number the vendor's own error message asserted, when it asserts one"
  },
  "row_count": 540,
  "data_files": [
    "probe_codex.jsonl",
    "probe_openai_limits.jsonl",
    "probe_results.jsonl",
    "probe_round5_anthropic.jsonl",
    "probe_round5_anthropic_refine.jsonl",
    "probe_round5_deepseek.jsonl",
    "probe_round5_fireworks-60.jsonl",
    "probe_round5_fireworks-60big.jsonl",
    "probe_round5_fireworks-count.jsonl",
    "probe_round5_gemini-count.jsonl",
    "probe_round5_gemini-lite.jsonl",
    "probe_round5_gemini-tok.jsonl",
    "probe_round5_gemini.jsonl",
    "probe_round5_geminilite.jsonl",
    "probe_round5_openai_41mini.jsonl",
    "probe_round5_qwencloud-250.jsonl",
    "probe_round5_qwencloud-count.jsonl",
    "probe_round5_qwencloud.jsonl",
    "probe_round5_squeeze.jsonl"
  ],
  "generated_from": [
    "probe_codex.jsonl",
    "probe_openai_limits.jsonl",
    "probe_results.jsonl",
    "probe_round5_anthropic.jsonl",
    "probe_round5_anthropic_refine.jsonl",
    "probe_round5_deepseek.jsonl",
    "probe_round5_fireworks-60.jsonl",
    "probe_round5_fireworks-60big.jsonl",
    "probe_round5_fireworks-count.jsonl",
    "probe_round5_gemini-count.jsonl",
    "probe_round5_gemini-lite.jsonl",
    "probe_round5_gemini-tok.jsonl",
    "probe_round5_gemini.jsonl",
    "probe_round5_geminilite.jsonl",
    "probe_round5_openai_41mini.jsonl",
    "probe_round5_qwencloud-250.jsonl",
    "probe_round5_qwencloud-count.jsonl",
    "probe_round5_qwencloud.jsonl",
    "probe_round5_squeeze.jsonl"
  ],
  "providers": [
    {
      "id": "openai",
      "provider": "OpenAI",
      "host": "api.openai.com",
      "wire": "openai",
      "model_tested": "gpt-4.1-mini",
      "measured_at": "2026-09-18",
      "binding_constraint": "total_image_bytes_budget",
      "caps": {
        "body_bytes": null,
        "per_item_bytes": null,
        "max_items": null,
        "budget_note": "50 MB applied to OpenAI's own normalised (downscaled) copy of the images, not to the bytes sent",
        "per_item_bytes_evidence": "no per-image cap found to 50.7 MB (single image accepted)"
      },
      "documented": {
        "current": {
          "text": "Request size: Up to 512 MB total payload per request. Image count: Up to 1,500 images per request.",
          "url": "https://developers.openai.com/api/docs/guides/images-vision",
          "retrieved": "2026-09-19"
        },
        "archived": [
          {
            "text": "Size limits: Up to 50 MB total payload size per request - Up to 500 individual image inputs per request",
            "url": "http://web.archive.org/web/20260305204402/https://developers.openai.com/api/docs/guides/images-vision",
            "captured": "2026-03-05"
          }
        ],
        "delta": "The current doc's 512 MB is unreachable: the API rejects at a 50 MB image-byte budget. The rule enforced today is the one the vendor deleted from this page between 2026-04-19 and 2026-04-24. See docs/findings.md."
      },
      "notes": "Two payload shapes probed. (a) many-small: 17 x 2,053,887 B accepted, 18 rejected at 400 'Total image size is 50.56MB, which exceeds the allowed limit of 50MB.' (b) few-large: 8 x 12,144,448 B accepted (raw 97,155,560 B, body 129,541,440 B) - a 3.5x larger payload than the rejected small-image one. Rejection is HTTP 400, not 413.",
      "confidence": "measured",
      "measured": {
        "largest_accepted": {
          "body_bytes": 129541440,
          "status": 200,
          "class": "ok",
          "error": "{ \"id\": \"chatcmpl-EPQn4DEfAR5mfzn27d4UNDJLZPlXY\", \"object\": \"chat.completion\", \"created\": 1789729890, \"model\": \"gpt-4.1-mini-2025-04-14\", \"choices\": [ { \"index\": 0, \"message\": { \"role\": \"assistant\", \"content\": \"ok\", \"refusal\": null, \"annota...",
          "images": 8,
          "model": "gpt-4.1-mini"
        },
        "walls": {
          "image_total": {
            "body_bytes": 49294630,
            "status": 400,
            "class": "image_total_cap",
            "error": "{ \"error\": { \"message\": \"Total image size is 50.56MB, which exceeds the allowed limit of 50MB.\", \"type\": \"invalid_request_error\", \"param\": \"messages\", \"code\": null } }",
            "cap_stated_in_error": 52428800,
            "images": 18,
            "model": "gpt-4.1-mini"
          }
        }
      },
      "evidence": [
        {
          "source_id": "openai_41mini",
          "rows": 17,
          "files": [
            "probe_round5_openai_41mini.jsonl"
          ],
          "largest_accepted": {
            "body_bytes": 63789772,
            "status": 200,
            "class": "ok",
            "error": "{ \"id\": \"chatcmpl-EPQNj0NL0VpUo4EEhBnmfObZW30aZ\", \"object\": \"chat.completion\", \"created\": 1789728319, \"model\": \"gpt-4.1-mini-2025-04-14\", \"choices\": [ { \"index\": 0, \"message\": { \"role\": \"assistant\", \"content\": \"ok\", \"refusal\": null, \"annota...",
            "images": 12,
            "model": "gpt-4.1-mini"
          },
          "most_images_accepted": {
            "body_bytes": 63789772,
            "status": 200,
            "class": "ok",
            "error": "{ \"id\": \"chatcmpl-EPQNj0NL0VpUo4EEhBnmfObZW30aZ\", \"object\": \"chat.completion\", \"created\": 1789728319, \"model\": \"gpt-4.1-mini-2025-04-14\", \"choices\": [ { \"index\": 0, \"message\": { \"role\": \"assistant\", \"content\": \"ok\", \"refusal\": null, \"annota...",
            "images": 12,
            "model": "gpt-4.1-mini"
          },
          "walls": {
            "image_total_cap": {
              "body_bytes": 85060472,
              "status": 400,
              "class": "image_total_cap",
              "error": "{ \"error\": { \"message\": \"Total image size is 64.05MB, which exceeds the allowed limit of 50MB.\", \"type\": \"invalid_request_error\", \"param\": \"messages\", \"code\": null } }",
              "cap_stated_in_error": 52428800,
              "images": 16,
              "model": "gpt-4.1-mini"
            }
          },
          "non_wall_failures": {}
        },
        {
          "source_id": "openai",
          "rows": 2,
          "files": [
            "probe_results.jsonl"
          ],
          "largest_accepted": null,
          "most_images_accepted": null,
          "walls": {},
          "non_wall_failures": {
            "rate_limit": 2
          }
        },
        {
          "source_id": "total",
          "rows": 20,
          "files": [
            "probe_openai_limits.jsonl"
          ],
          "largest_accepted": null,
          "most_images_accepted": null,
          "walls": {
            "image_total_cap": {
              "body_bytes": 60226346,
              "status": 400,
              "class": "image_total_cap",
              "error": "{ \"error\": { \"message\": \"Total image size is 61.75MB, which exceeds the allowed limit of 50MB.\", \"type\": \"invalid_request_error\", \"param\": \"messages\", \"code\": null } }",
              "cap_stated_in_error": 52428800,
              "images": 22,
              "model": "gpt-4.1-mini"
            }
          },
          "non_wall_failures": {}
        },
        {
          "source_id": "count",
          "rows": 12,
          "files": [
            "probe_openai_limits.jsonl"
          ],
          "largest_accepted": {
            "body_bytes": 4396436,
            "status": 200,
            "class": "ok",
            "error": "{ \"id\": \"chatcmpl-EPQaheBlnCYwqeyoNpGJyQUT4OmSK\", \"object\": \"chat.completion\", \"created\": 1789729123, \"model\": \"gpt-4.1-mini-2025-04-14\", \"choices\": [ { \"index\": 0, \"message\": { \"role\": \"assistant\", \"content\": \"ok\", \"refusal\": null, \"annota...",
            "images": 100,
            "model": "gpt-4.1-mini"
          },
          "most_images_accepted": {
            "body_bytes": 4296036,
            "status": 200,
            "class": "ok",
            "error": "{ \"id\": \"chatcmpl-EPQREp4k8IWFqiW9upXsvLj4BWZWi\", \"object\": \"chat.completion\", \"created\": 1789728536, \"model\": \"gpt-4.1-mini-2025-04-14\", \"choices\": [ { \"index\": 0, \"message\": { \"role\": \"assistant\", \"content\": \"ok\", \"refusal\": null, \"annota...",
            "images": 100,
            "model": "gpt-4.1-mini"
          },
          "walls": {},
          "non_wall_failures": {}
        },
        {
          "source_id": "single",
          "rows": 14,
          "files": [
            "probe_openai_limits.jsonl"
          ],
          "largest_accepted": {
            "body_bytes": 67619247,